{
  "grantId": "GRANT-FF-M01-001-0001",
  "taskId": "FF-M01-001",
  "capabilityVersion": 1,
  "issuedAt": "2026-08-18T20:30:00Z",
  "expiresAt": "2026-08-19T20:30:00Z",
  "identity": {
    "agent": "Codex /root",
    "roleType": "implementer",
    "specialty": "security",
    "workspace": "."
  },
  "files": {
    "read": [
      "README.md",
      "docs/00-governance/project-status.md",
      "docs/01-product/FrameFlow-PRD.md",
      "docs/02-architecture/**",
      "docs/03-data/**",
      "docs/04-api/**",
      "docs/05-engineering/development-plan-p0-m17.md",
      "docs/05-engineering/task-capsule-spec.md",
      "docs/05-engineering/tasks/P0/FF-P0-001.json"
    ],
    "write": [
      "README.md",
      "frameflow-modules/identity/**",
      "frameflow-app/src/main/resources/db/migration/V2__identity.sql",
      "frameflow-app/src/test/**",
      "scripts/m01/**",
      "evidence/m01/**",
      "docs/00-governance/project-status.md",
      "docs/05-engineering/task-capsule-catalog.md",
      "docs/05-engineering/generated/task-capsule-index.md",
      "docs/09-delivery/evidence-index.md"
    ]
  },
  "commands": [
    {
      "pattern": "mvn -B clean verify",
      "policy": "exact"
    },
    {
      "pattern": "mvn -B test",
      "policy": "exact"
    },
    {
      "pattern": "mvn -pl frameflow-app test",
      "policy": "prefix"
    },
    {
      "pattern": "docker compose -f docker-compose.local.yml config",
      "policy": "exact"
    },
    {
      "pattern": "docker compose -f docker-compose.local.yml up -d --wait",
      "policy": "exact"
    },
    {
      "pattern": "sh scripts/m01/auth-flows.sh",
      "policy": "exact"
    },
    {
      "pattern": "sh scripts/m01/check-migration.sh",
      "policy": "exact"
    },
    {
      "pattern": "sh scripts/m01/check-openapi-diff.sh",
      "policy": "exact"
    }
  ],
  "network": {
    "allowExternal": false,
    "allowLocal": true,
    "allowRegistry": true
  },
  "tools": [
    "repo-read",
    "repo-write",
    "git-read",
    "test-run",
    "docker",
    "mcp-read"
  ],
  "approvals": [
    {
      "action": "migration-v2",
      "approvalType": "local",
      "status": "approved"
    }
  ]
}
