{
  "grantId": "GRANT-FF-P0-001-0001",
  "taskId": "FF-P0-001",
  "capabilityVersion": 1,
  "issuedAt": "2026-08-13T03:09:10Z",
  "expiresAt": "2026-08-14T03:09:10Z",
  "identity": {
    "agent": "Codex /root",
    "roleType": "implementer",
    "specialty": "general",
    "workspace": "."
  },
  "files": {
    "read": [
      "README.md",
      "docs/00-governance/project-status.md",
      "docs/00-governance/documentation-policy.md",
      "docs/01-product/FrameFlow-PRD.md",
      "docs/02-architecture/FrameFlow-概要设计.md",
      "docs/02-architecture/adr/**",
      "docs/03-data/FrameFlow-详细设计.md",
      "docs/04-api/api-guidelines.md",
      "docs/04-api/error-code-catalog.md",
      "docs/05-engineering/development-plan-p0-m17.md",
      "docs/05-engineering/task-capsule-spec.md",
      "docs/05-engineering/local-development.md"
    ],
    "write": [
      "README.md",
      "pom.xml",
      "mvnw",
      "mvnw.cmd",
      ".mvn/**",
      "frameflow-app/**",
      "frameflow-modules/**",
      "frameflow-shared-kernel/**",
      "docker-compose.local.yml",
      ".env.example",
      ".gitattributes",
      ".gitignore",
      ".github/workflows/ci.yml",
      "scripts/p0/**",
      "evidence/p0/**",
      "docs/00-governance/project-status.md",
      "docs/05-engineering/task-capsule-catalog.md",
      "docs/05-engineering/generated/task-capsule-index.md",
      "docs/09-delivery/evidence-index.md"
    ]
  },
  "commands": [
    { "pattern": "mvn -B clean verify", "policy": "exact" },
    { "pattern": "mvn -B -DskipTests validate", "policy": "exact" },
    { "pattern": "mvn -B test", "policy": "exact" },
    { "pattern": "docker compose -f docker-compose.local.yml config", "policy": "exact" },
    { "pattern": "docker compose -f docker-compose.local.yml up -d --wait", "policy": "exact" },
    { "pattern": "sh scripts/p0/check-health.sh", "policy": "exact" },
    { "pattern": "sh scripts/p0/check-readiness-db-down.sh", "policy": "exact" },
    { "pattern": "sh scripts/p0/check-readiness-db-up.sh", "policy": "exact" },
    { "pattern": "sh scripts/p0/check-flyway.sh", "policy": "exact" },
    { "pattern": "sh scripts/p0/check-repo-hygiene.sh", "policy": "exact" },
    { "pattern": "sh scripts/p0/check-build.sh", "policy": "exact" },
    { "pattern": "mvn -N org.apache.maven.plugins:maven-wrapper-plugin:3.3.2:wrapper -Dmaven=3.9.6 -Dtype=only-script", "policy": "exact" },
    { "pattern": "git init -b main", "policy": "exact" },
    { "pattern": "git switch -c feat/ff-p0-001", "policy": "exact" },
    { "pattern": "git status", "policy": "exact" },
    { "pattern": "git add -A", "policy": "exact" },
    { "pattern": "git commit -m", "policy": "prefix" },
    { "pattern": "java -version", "policy": "exact" },
    { "pattern": "mvn -version", "policy": "exact" }
  ],
  "network": {
    "allowExternal": false,
    "allowLocal": true,
    "allowRegistry": true
  },
  "tools": ["repo-read", "repo-write", "git-read", "test-run", "docker", "mcp-read"],
  "approvals": [
    { "action": "git-init", "approvalType": "irreversible", "status": "approved" },
    { "action": "p0-execution", "approvalType": "local", "status": "approved" },
    { "action": "compose-up", "approvalType": "local", "status": "approved" },
    { "action": "first-migration", "approvalType": "local", "status": "approved" }
  ]
}
